{
  "version": "2026-07-14-v1",
  "verifiedAt": "2026-07-14",
  "releaseBoundary": "This registry distinguishes evidence already displayed in the public CB-CAP release from official sources prepared for future governed ingestion. A listed source is not evidence that its measures are currently displayed.",
  "geographySearch": {
    "statesAndDistrictOfColumbia": {
      "count": 51,
      "status": "committed"
    },
    "countyEquivalents": {
      "count": 3144,
      "status": "committed"
    },
    "placesAndCities": {
      "status": "authoritative-on-demand",
      "includes": [
        "incorporated places",
        "Census-designated places",
        "consolidated cities",
        "GNIS populated communities when no Census place result is available"
      ]
    },
    "townsAndLocalities": {
      "status": "authoritative-on-demand",
      "includes": [
        "county subdivisions",
        "towns represented as Census county subdivisions",
        "GNIS populated communities when no Census place or subdivision result is available"
      ]
    },
    "zipLinkedAreas": {
      "status": "authoritative-on-demand",
      "label": "Census ZCTA",
      "boundary": "A ZIP Code Tabulation Area is a Census statistical area, not a USPS delivery route. Not every ZIP Code has a ZCTA, and a ZCTA should not be presented as a postal service area."
    }
  },
  "sources": [
    {
      "id": "census-tigerweb-current",
      "label": "TIGERweb current geography services",
      "agency": "U.S. Census Bureau",
      "domain": "geography",
      "evidenceClass": "official-geography",
      "officialUrl": "https://tigerweb.geo.census.gov/tigerwebmain/TIGERweb_main.html",
      "integrationStatus": "integrated-on-demand",
      "geographyLevels": [
        "state",
        "county",
        "place",
        "county-subdivision",
        "zcta"
      ],
      "release": "Current TIGERweb service; the committed county boundary snapshot uses the January 1, 2025 vintage",
      "freshness": {
        "checkedAt": "2026-07-14",
        "cadence": "On-demand lookup cached for up to seven days; committed state and county snapshot refreshed through the governed release workflow",
        "snapshotGeneratedAt": "2026-07-14T02:50:00.196Z"
      },
      "coverage": {
        "scope": "50 states, the District of Columbia, and 3,144 current county equivalents in the committed release; supported subcounty geographies are queried from TIGERweb",
        "status": "complete-national-snapshot",
        "numerator": 3144,
        "denominator": 3144,
        "unit": "county equivalents"
      },
      "purpose": "Authoritative names, identifiers, geography types, and boundaries for nationwide search and map joins.",
      "limitations": [
        "A Census place or county subdivision may differ from a postal city name or local administrative usage.",
        "Geography verification does not establish that compatible health, workforce, broadband, or local program evidence is available."
      ]
    },
    {
      "id": "usgs-gnis-populated-places",
      "label": "Geographic Names Information System populated places",
      "agency": "U.S. Geological Survey",
      "domain": "geography",
      "evidenceClass": "official-geography",
      "officialUrl": "https://www.usgs.gov/tools/geographic-names-information-system-gnis",
      "integrationStatus": "integrated-on-demand",
      "geographyLevels": [
        "community"
      ],
      "release": "Current GNIS public service",
      "freshness": {
        "checkedAt": "2026-07-14",
        "cadence": "Fallback name lookup cached for up to seven days when Census place and county-subdivision search returns no match",
        "snapshotGeneratedAt": null
      },
      "coverage": {
        "scope": "Federally recognized domestic populated-place names in the 50 states and District of Columbia",
        "status": "national-on-demand",
        "numerator": null,
        "denominator": null,
        "unit": null
      },
      "purpose": "Find named communities, including populated places that are not represented by a current Census place or county-subdivision result.",
      "limitations": [
        "A GNIS populated place is a named point, not a Census statistical area, municipal boundary, postal city, provider market, or service area.",
        "The current release verifies the name and source only; it does not infer a community health profile or transfer county estimates to the community."
      ]
    },
    {
      "id": "cdc-places-county-2025",
      "label": "PLACES County Data, GIS Friendly Format, 2025 release",
      "agency": "Centers for Disease Control and Prevention",
      "domain": "population-health",
      "evidenceClass": "official-statistical-data",
      "officialUrl": "https://data.cdc.gov/500-Cities-Places/PLACES-County-Data-GIS-Friendly-Format-2025-releas/i46a-9kgh",
      "integrationStatus": "integrated-snapshot",
      "geographyLevels": [
        "county"
      ],
      "release": "Released December 4, 2025; source years vary by measure",
      "freshness": {
        "checkedAt": "2026-07-14",
        "cadence": "Release-based governed refresh",
        "snapshotGeneratedAt": "2026-07-14T02:50:00.196Z"
      },
      "coverage": {
        "scope": "3,143 of 3,144 current county equivalents have a matched CDC PLACES row in the committed release",
        "status": "complete-national-snapshot",
        "numerator": 3143,
        "denominator": 3144,
        "unit": "county equivalents with a matched source row"
      },
      "purpose": "Model-based area estimates for chronic conditions, prevention, health-related social needs, and accessibility context.",
      "limitations": [
        "PLACES values are model-based population estimates, not diagnoses, person-level facts, observed service demand, or program results.",
        "Measures use different eligible populations and source years and must be interpreted one measure at a time.",
        "Missing values remain missing and are never converted to zero."
      ]
    },
    {
      "id": "cdc-places-place-2025",
      "label": "PLACES Place Data, GIS Friendly Format, 2025 release",
      "agency": "Centers for Disease Control and Prevention",
      "domain": "population-health",
      "evidenceClass": "official-statistical-data",
      "officialUrl": "https://data.cdc.gov/d/vgc8-iyc4",
      "integrationStatus": "integrated-on-demand",
      "geographyLevels": [
        "place"
      ],
      "release": "Released December 4, 2025; source years vary by measure",
      "freshness": {
        "checkedAt": "2026-07-14",
        "cadence": "Exact place GEOID lookup cached for up to one day",
        "snapshotGeneratedAt": null
      },
      "coverage": {
        "scope": "Compatible incorporated-place and Census-designated-place estimates are checked after a verified Census place is selected",
        "status": "national-on-demand",
        "numerator": null,
        "denominator": null,
        "unit": null
      },
      "purpose": "On-demand place-level population-health and health-related social-needs context.",
      "limitations": [
        "A Census place may cross county boundaries and may differ from a postal city name.",
        "A verified place with no compatible PLACES row remains visible as geography only."
      ]
    },
    {
      "id": "cdc-places-zcta-2025",
      "label": "PLACES ZCTA Data, GIS Friendly Format, 2025 release",
      "agency": "Centers for Disease Control and Prevention",
      "domain": "population-health",
      "evidenceClass": "official-statistical-data",
      "officialUrl": "https://data.cdc.gov/d/kee5-23sr",
      "integrationStatus": "integrated-on-demand",
      "geographyLevels": [
        "zcta"
      ],
      "release": "Released December 4, 2025; source years vary by measure",
      "freshness": {
        "checkedAt": "2026-07-14",
        "cadence": "Exact ZCTA lookup cached for up to one day",
        "snapshotGeneratedAt": null
      },
      "coverage": {
        "scope": "Compatible Census ZCTA estimates are checked after a verified ZCTA is selected",
        "status": "national-on-demand",
        "numerator": null,
        "denominator": null,
        "unit": null
      },
      "purpose": "ZIP-linked population-health and health-related social-needs context where a Census ZCTA exists.",
      "limitations": [
        "A ZCTA is not a USPS ZIP Code delivery route and should not be presented as an exact ZIP Code boundary.",
        "A verified ZCTA with no compatible PLACES row remains visible as geography only."
      ]
    },
    {
      "id": "census-acs5-2024",
      "label": "American Community Survey 2024 five-year estimates",
      "agency": "U.S. Census Bureau",
      "domain": "community-conditions",
      "evidenceClass": "official-statistical-data",
      "officialUrl": "https://www.census.gov/data/developers/data-sets/acs-5year.html",
      "integrationStatus": "planned-ingestion",
      "geographyLevels": [
        "state",
        "county",
        "place",
        "county-subdivision",
        "census-tract",
        "zcta"
      ],
      "release": "2024 ACS five-year estimates",
      "freshness": {
        "checkedAt": "2026-07-14",
        "cadence": "Annual release; not yet ingested into the public CB-CAP evidence view",
        "snapshotGeneratedAt": null
      },
      "coverage": {
        "scope": "Official national ACS five-year program; selected variables and margins of error require governed ingestion and validation",
        "status": "planned-not-displayed",
        "numerator": null,
        "denominator": null,
        "unit": null
      },
      "purpose": "Future local context for demographics, language, disability, broadband subscription, vehicles, income, poverty, housing, and other community conditions.",
      "limitations": [
        "No ACS variable is displayed from this registry entry in the current public release.",